"name","description","category","price","alcoholPercentage","volume"
"Margarita","A refreshing cocktail with lime juice and tequila","0","850","40","250"
"Red Wine","Full-bodied red wine with notes of cherry and oak","5","2500","14","750"
"Cappuccino","A hot beverage with espresso and steamed milk","2","500","0","250"
"Strawberry Smoothie","A fresh smoothie with strawberries and yogurt","11","600","0","350"
"Whiskey","Aged whiskey with a smooth finish","7","3000","45","700"
"Vodka","Pure vodka with a clean taste","8","1500","40","700"
